tweet_id,timestamp,text,name,numerator,denominator,dog_stage,rating_ratio,dog_breed50,dog_breed60,dog_breed70,dog_breed80,dog_breed90,favorite_count,retweet_count
780459368902959104,2016-09-26 17:29:48+00:00,"This is Bear. Don't worry, he's not a real bear tho. Contains unreal amounts of squish. 11/10 heteroskedastic af ",Bear,11.0,10.0,None,1.1,None,None,None,None,None,5512.0,1126.0
780192070812196864,2016-09-25 23:47:39+00:00,We only rate dogs. Pls stop sending in non-canines like this Urban Floof Giraffe. I can't handle this. 11/10 ,None,11.0,10.0,None,1.1,None,None,None,None,None,9065.0,2346.0
780092040432480260,2016-09-25 17:10:10+00:00,This is Hank. He's mischievous af. Doesn't even know what he was trying to do here. 8/10 quit the shit Hank damn ,Hank,8.0,10.0,None,0.8,,,,,,0.0,2418.0
780074436359819264,2016-09-25 16:00:13+00:00,Here's a doggo questioning his entire existence. 10/10 someone tell him he's a good boy  ,None,10.0,10.0,doggo,1.0,,,,,,12753.0,5217.0
779377524342161408,2016-09-23 17:50:56+00:00,Have you ever seen such a smol pupper? Portable af. 12/10 would keep in shirt pocket ,None,12.0,10.0,None,1.2,None,None,None,None,None,9189.0,3256.0
779124354206535695,2016-09-23 01:04:56+00:00,Meet Hurley. He's the curly one. He hugs every other dog he sees during his walk. 11/10 for spreading the love ,Hurley,11.0,10.0,None,1.1,,,,,,0.0,19271.0
779123168116150273,2016-09-23 01:00:13+00:00,This is Reggie. He hugs everyone he meets. 12/10 keep spreading the love Reggie ,Reggie,12.0,10.0,None,1.2,None,None,None,None,None,,
778990705243029504,2016-09-22 16:13:51+00:00,This is Jay. He's really h*ckin happy about the start of fall. Sneaky tongue slip in 2nd pic. 11/10 snuggly af ,Jay,11.0,10.0,None,1.1,cocker spaniel,cocker spaniel,cocker spaniel,None,None,20852.0,7570.0
778774459159379968,2016-09-22 01:54:34+00:00,In case you haven't seen the most dramatic sneeze ever... 13/10 ,None,13.0,10.0,None,1.3,,,,,,0.0,10403.0
778764940568104960,2016-09-22 01:16:45+00:00,"Oh my god it's Narcos but Barkos. 13/10 someone please make this happen
",None,13.0,10.0,None,1.3,,,,,,899.0,383.0
778748913645780993,2016-09-22 00:13:04+00:00,"This is Mya (pronounced ""mmmyah?""). Her head is round af. 11/10 would pat accordingly ",Mya,11.0,10.0,None,1.1,None,None,None,None,None,7188.0,1378.0
778650543019483137,2016-09-21 17:42:10+00:00,"Meet Strider. He thinks he's a sorority girl. Already wants to go to NYC for a weekend to say he's ""studied abroad"" 10/10 ",Strider,10.0,10.0,None,1.0,german shepherd,None,None,None,None,6008.0,1580.0
778624900596654080,2016-09-21 16:00:17+00:00,This is Penny. She's a sailor pup. 11/10 would take to the open seas with ,Penny,11.0,10.0,None,1.1,airedale,airedale,airedale,None,None,4823.0,1059.0
778408200802557953,2016-09-21 01:39:11+00:00,RIP Loki. Thank you for the good times. You will be missed by many. 14/10 ,None,14.0,10.0,None,1.4,pembroke,pembroke,pembroke,pembroke,None,14218.0,4542.0
778396591732486144,2016-09-21 00:53:04+00:00,This is an East African Chalupa Seal. We only rate dogs. Please only send in dogs. Thank you... 10/10 ,None,10.0,10.0,None,1.0,None,None,None,None,None,0.0,12815.0
778383385161035776,2016-09-21 00:00:35+00:00,This is Nala. She's a future Dogue model. Won't respond to my texts. 13/10 would be an honor to pet ,Nala,13.0,10.0,None,1.3,None,None,None,None,None,6087.0,1153.0
778286810187399168,2016-09-20 17:36:50+00:00,This is Stanley. He has too much skin. Isn't happy about it. Quite pupset actually. Still 11/10 would comfort ,Stanley,11.0,10.0,None,1.1,None,None,None,None,None,10831.0,3452.0
778039087836069888,2016-09-20 01:12:28+00:00,Evolution of a pupper yawn featuring Max. 12/10 groundbreaking stuff ,None,12.0,10.0,None,1.2,german shepherd,german shepherd,german shepherd,None,None,8834.0,2760.0
778027034220126208,2016-09-20 00:24:34+00:00,This is Sophie. She's a Jubilant Bush Pupper. Super h*ckin rare. Appears at random just to smile at the locals. 11.27/10 would smile back ,Sophie,11.27,10.0,None,1.127,clumber,clumber,clumber,clumber,clumber,6825.0,1700.0
777953400541634568,2016-09-19 19:31:59+00:00,Meet Gerald. He's a fairly exotic doggo. Floofy af. Inadequate knees tho. Self conscious about large forehead. 8/10 ,Gerald,8.0,10.0,doggo,0.8,,,,,,0.0,3709.0
777885040357281792,2016-09-19 15:00:20+00:00,This is Wesley. He's clearly trespassing. Seems rather h*ckin violent too. Weaponized forehead. 3/10 wouldn't let in ,Wesley,3.0,10.0,None,0.3,None,None,None,None,None,6620.0,1708.0
777641927919427584,2016-09-18 22:54:18+00:00,This is Arnie. He's a Nova Scotian Fridge Floof. Rare af. 12/10 ,Arnie,12.0,10.0,None,1.2,golden retriever,golden retriever,golden retriever,golden retriever,golden retriever,0.0,4428.0
777621514455814149,2016-09-18 21:33:11+00:00,This is Derek. You can't look at him and not smile. Must've just had a blue pupsicle. 12/10 would snug intensely ,Derek,12.0,10.0,None,1.2,chow,chow,chow,chow,chow,9126.0,2606.0
777189768882946048,2016-09-17 16:57:35+00:00,This is Jeffrey. He's being held so he doesn't fly away. 12/10 would set free ,Jeffrey,12.0,10.0,None,1.2,chihuahua,chihuahua,chihuahua,chihuahua,chihuahua,14879.0,4499.0
776819012571455488,2016-09-16 16:24:19+00:00,Everybody look at this beautiful pupper 13/10 ,None,13.0,10.0,None,1.3,None,None,None,None,None,0.0,14339.0
776813020089548800,2016-09-16 16:00:31+00:00,Meet Solomon. He was arrested for possession of adorable and attempted extra pats on the head. 12/10 would post bail ,Solomon,12.0,10.0,None,1.2,toy poodle,None,None,None,None,5078.0,1271.0
776477788987613185,2016-09-15 17:48:25+00:00,This is Huck. He's addicted to caffeine. Hope it's not too latte to seek help. 11/10 stay strong pupper ,Huck,11.0,10.0,None,1.1,labrador retriever,labrador retriever,labrador retriever,labrador retriever,None,9206.0,2905.0
776249906839351296,2016-09-15 02:42:54+00:00,We only rate dogs. Pls stop sending in non-canines like this Mongolian grass snake. This is very frustrating. 11/10 ,None,11.0,10.0,None,1.1,,,,,,0.0,9576.0
776218204058357768,2016-09-15 00:36:55+00:00,Atlas rolled around in some chalk and now he's a magical rainbow floofer. 13/10 please never take a bath ,None,13.0,10.0,None,1.3,samoyed,samoyed,samoyed,samoyed,samoyed,31175.0,16652.0
776201521193218049,2016-09-14 23:30:38+00:00,This is O'Malley. That is how he sleeps. Doesn't care what you think about it. 10/10 comfy af ,O,10.0,10.0,None,1.0,rottweiler,None,None,None,None,10000.0,2634.0
776088319444877312,2016-09-14 16:00:49+00:00,I can't tap the screen to make the hearts appear fast enough. 10/10 for the source of all future unproductiveness ,None,10.0,10.0,None,1.0,None,None,None,None,None,1913.0,158.0
775898661951791106,2016-09-14 03:27:11+00:00,"Like father (doggo), like son (pupper). Both 12/10 ",None,12.0,10.0,doggo,1.2,golden retriever,golden retriever,golden retriever,golden retriever,golden retriever,0.0,17181.0
775842724423557120,2016-09-13 23:44:54+00:00,This is Blue. He was having an average day until his owner told him about Bront. 12/10 h*ckin hysterical af ,Blue,12.0,10.0,None,1.2,chow,None,None,None,None,12189.0,2798.0
775729183532220416,2016-09-13 16:13:44+00:00,This girl straight up rejected a guy because he doesn't like dogs. She is my hero and I give her 13/10 ,None,13.0,10.0,None,1.3,None,None,None,None,None,13458.0,4807.0
775364825476165632,2016-09-12 16:05:54+00:00,This is Finley. He's an independent doggo still adjusting to life on his own. 11/10 ,Finley,11.0,10.0,doggo,1.1,beagle,None,None,None,None,7704.0,3115.0
775350846108426240,2016-09-12 15:10:21+00:00,This is Maximus. A little rain won't stop him. He will persevere. 12/10 innovative af  ,Maximus,12.0,10.0,None,1.2,,,,,,10568.0,4080.0
775096608509886464,2016-09-11 22:20:06+00:00,"After so many requests, this is Bretagne. She was the last surviving 9/11 search dog, and our second ever 14/10. RIP ",None,9.0,11.0,None,0.8181818181818182,,,,,,,
774757898236878852,2016-09-10 23:54:11+00:00,This is Finley. She's a Beneboop Cumbersplash. 12/10 I'd do unspeakable things for Finley ,Finley,12.0,10.0,None,1.2,toy poodle,toy poodle,toy poodle,None,None,8919.0,1857.0
774639387460112384,2016-09-10 16:03:16+00:00,This is Sprinkles. He's trapped in light jail. 10/10 would post bail for him ,Sprinkles,10.0,10.0,None,1.0,walker hound,walker hound,None,None,None,6984.0,1805.0
773985732834758656,2016-09-08 20:45:53+00:00,Meet Winnie. She just made awkward eye contact with the driver beside her. Poor pupper panicked. 11/10 would comfort ,Winnie,11.0,10.0,None,1.1,None,None,None,None,None,11144.0,4047.0
773922284943896577,2016-09-08 16:33:46+00:00,"This is Heinrich (pronounced ""Pat""). He's a Botswanian Vanderfloof. Snazzy af bandana. 12/10 downright puptacular ",Heinrich,12.0,10.0,None,1.2,pomeranian,None,None,None,None,6655.0,1826.0
773704687002451968,2016-09-08 02:09:06+00:00,This is Loki. He knows he's adorable. One ear always pupared. 12/10 would snug in depicted fashion forever ,Loki,12.0,10.0,None,1.2,None,None,None,None,None,6872.0,1700.0
773670353721753600,2016-09-07 23:52:41+00:00,This is Shakespeare. He appears to be maximum level pettable. Born with no eyes tho (tragic). 10/10 probably wise ,Shakespeare,10.0,10.0,None,1.0,old english sheepdog,old english sheepdog,old english sheepdog,old english sheepdog,old english sheepdog,5538.0,1360.0
773336787167145985,2016-09-07 01:47:12+00:00,Meet Fizz. She thinks love is a social construct consisting solely of ideals perpetuated by mass media 11/10 woke af ,Fizz,11.0,10.0,None,1.1,,,,,,0.0,5314.0
773247561583001600,2016-09-06 19:52:39+00:00,This is Chip. He's a pupholder. Comes with the car. Requires frequent pettings. Shifts for you. 10/10 innovative af ,Chip,10.0,10.0,None,1.0,None,None,None,None,None,9796.0,3385.0
773191612633579521,2016-09-06 16:10:20+00:00,This is Grey. He's the dogtor in charge of your checkpup today. 12/10 I'd never miss an appointment ,Grey,12.0,10.0,None,1.2,None,None,None,None,None,10381.0,4317.0
772877495989305348,2016-09-05 19:22:09+00:00,You need to watch these two doggos argue through a cat door. Both 11/10 ,None,11.0,10.0,doggo,1.1,None,None,None,None,None,8899.0,4051.0
772826264096874500,2016-09-05 15:58:34+00:00,"Meet Roosevelt. He's preparing for takeoff. Make sure tray tables are in their full pupright &amp; licked position
11/10 ",Roosevelt,11.0,10.0,None,1.1,basset,basset,basset,basset,basset,8340.0,2448.0
772615324260794368,2016-09-05 02:00:22+00:00,This is Gromit. He's pupset because there's no need to beware of him. Just wants a pettin. 10/10 ,Gromit,10.0,10.0,None,1.0,dalmatian,None,None,None,None,0.0,3519.0
772581559778025472,2016-09-04 23:46:12+00:00,Guys this is getting so out of hand. We only rate dogs. This is a Galapagos Speed Panda. Pls only send dogs... 10/10 ,None,10.0,10.0,None,1.0,newfoundland,None,None,None,None,6744.0,1764.0
772193107915964416,2016-09-03 22:02:38+00:00,This is Willem. He's a Penn State pupper. Thinks the hood makes him more intimidating. It doesn't. 12/10 ,Willem,12.0,10.0,None,1.2,None,None,None,None,None,6281.0,1449.0
772152991789019136,2016-09-03 19:23:13+00:00,Here's a couple rufferees making sure all the sports are played fairly today. Both 10/10 would bribe with extra pets ,None,10.0,10.0,None,1.0,None,None,None,None,None,3943.0,1176.0
772117678702071809,2016-09-03 17:02:54+00:00,Meet Jack. He's a Clemson pup. Appears to be rather h*ckin pettable. Almost makes me want to root for Clemson. 12/10 ,Jack,12.0,10.0,None,1.2,None,None,None,None,None,3918.0,771.0
772114945936949249,2016-09-03 16:52:02+00:00,This is Finn. He's very nervous for the game. Has a lot of money riding on it.10/10 would attempt to comfort ,Finn,10.0,10.0,None,1.0,chihuahua,chihuahua,chihuahua,chihuahua,None,2815.0,487.0
772102971039580160,2016-09-03 16:04:27+00:00,This is Penny. She's an OU cheerleader. About to do a triple back handspring down the stairs. 11/10 hype af ,Penny,11.0,10.0,None,1.1,pembroke,None,None,None,None,4161.0,970.0
771908950375665664,2016-09-03 03:13:29+00:00,"Doggo will persevere. 13/10
",None,13.0,10.0,doggo,1.3,,,,,,6828.0,1982.0
771500966810099713,2016-09-02 00:12:18+00:00,This is Dakota. He's just saying hi. That's all. 12/10 someone wave back ,Dakota,12.0,10.0,None,1.2,labrador retriever,labrador retriever,labrador retriever,labrador retriever,None,8576.0,2717.0
771171053431250945,2016-09-01 02:21:21+00:00,This is Frankie. He's wearing blush. 11/10 really accents the cheek bones ,Frankie,11.0,10.0,None,1.1,samoyed,samoyed,samoyed,samoyed,samoyed,0.0,7842.0
771136648247640064,2016-09-01 00:04:38+00:00,This is Dixie. She wants to be a ship captain. Won't let anything get in between her and her dreams. 11/10 ,Dixie,11.0,10.0,None,1.1,None,None,None,None,None,9501.0,3049.0
771102124360998913,2016-08-31 21:47:27+00:00,This is Charlie. He works for @TODAYshow. Super sneaky tongue slip here. 12/10 would pet until someone made me stop ,Charlie,12.0,10.0,None,1.2,labrador retriever,None,None,None,None,6484.0,1495.0
771014301343748096,2016-08-31 15:58:28+00:00,Another pic without a dog in it? What am I supposed to do? Rate the carpet? Fine I will. 7/10 looks adequately comfy ,None,7.0,10.0,None,0.7,None,None,None,None,None,7141.0,1720.0
771004394259247104,2016-08-31 15:19:06+00:00,RT @katieornah: @dog_rates learning a lot at college 12/10 for my professor thank u for the pupper slides ,None,12.0,10.0,None,1.2,None,None,None,None,None,0.0,225.0
770787852854652928,2016-08-31 00:58:39+00:00,This is Winston. His tongue has gone rogue. Doing him quite a frighten. 10/10 hang in there Winston ,Winston,10.0,10.0,None,1.0,bernese mountain dog,bernese mountain dog,bernese mountain dog,None,None,5130.0,1257.0
770772759874076672,2016-08-30 23:58:40+00:00,This is Sebastian. He's super h*ckin fluffy. That's really all you need to know. 11/10 would snug intensely ,Sebastian,11.0,10.0,None,1.1,chow,chow,chow,chow,chow,5374.0,1476.0
770743923962707968,2016-08-30 22:04:05+00:00,Here's a doggo blowing bubbles. It's downright legendary. 13/10 would watch on repeat forever (vid by Kent Duryee) ,None,13.0,10.0,doggo,1.3,,,,,,,
770655142660169732,2016-08-30 16:11:18+00:00,We only rate dogs. Pls stop sending in non-canines like this Arctic Floof Kangaroo. This is very frustrating. 11/10 ,None,11.0,10.0,None,1.1,None,None,None,None,None,7593.0,1829.0
770414278348247044,2016-08-30 00:14:12+00:00,Meet Al Cabone. He's a gangsta puppa. Rather h*ckin ruthless. Shows no mercy sometimes. 11/10 pet w extreme caution ,Al,11.0,10.0,None,1.1,None,None,None,None,None,6540.0,2175.0
770293558247038976,2016-08-29 16:14:30+00:00,This is Jackson. There's nothing abnormal about him. Just your average really good dog. 10/10 ,Jackson,10.0,10.0,None,1.0,italian greyhound,italian greyhound,italian greyhound,italian greyhound,italian greyhound,6476.0,1547.0
770093767776997377,2016-08-29 03:00:36+00:00,This is just downright precious af. 12/10 for both pupper and doggo ,None,12.0,10.0,doggo,1.2,golden retriever,golden retriever,golden retriever,golden retriever,None,0.0,3182.0
770069151037685760,2016-08-29 01:22:47+00:00,Say hello to Carbon. This is his first time swimming. He's having a h*ckin blast. 10/10 we should all be this happy ,Carbon,10.0,10.0,None,1.0,None,None,None,None,None,7862.0,2393.0
769695466921623552,2016-08-28 00:37:54+00:00,This is Titan. He's trying to make friends. Offering up his favorite stick. 13/10 philanthropic af ,Titan,13.0,10.0,None,1.3,None,None,None,None,None,6629.0,1732.0
769335591808995329,2016-08-27 00:47:53+00:00,Ever seen a dog pet another dog? Both 13/10 truly an awe-inspiring scene. (Vid by @mdougherty20) ,None,13.0,10.0,None,1.3,,,,,,0.0,8038.0
769212283578875904,2016-08-26 16:37:54+00:00,This is DonDon. He's way up but doesn't feel blessed. Rather uncomfortable actually. 12/10 I'll save you DonDon ,DonDon,12.0,10.0,None,1.2,None,None,None,None,None,5603.0,1786.0
768970937022709760,2016-08-26 00:38:52+00:00,This is Kirby. His bowl weighs more than him. 12/10 would assist ,Kirby,12.0,10.0,None,1.2,None,None,None,None,None,14961.0,6794.0
768909767477751808,2016-08-25 20:35:48+00:00,When it's Janet from accounting's birthday but you can't eat the cake cuz it's chocolate. 10/10 hang in there pupper ,None,10.0,10.0,None,1.0,,,,,,0.0,2801.0
768855141948723200,2016-08-25 16:58:45+00:00,This is Jesse. He really wants a belly rub. Will be as cute as possible to achieve that goal. 11/10 ,Jesse,11.0,10.0,None,1.1,chow,chow,chow,None,None,4354.0,927.0
768609597686943744,2016-08-25 00:43:02+00:00,This is Lou. His sweater is too small and he already cut the tags off. Very very churlish. 10/10 would still pet ,Lou,10.0,10.0,None,1.0,None,None,None,None,None,4268.0,1251.0
768596291618299904,2016-08-24 23:50:10+00:00,Say hello to Oakley and Charlie. They're convinced that they each have their own stick. Nobody tell them. Both 12/10 ,Oakley,12.0,10.0,None,1.2,great pyrenees,great pyrenees,great pyrenees,None,None,5221.0,1334.0
768554158521745409,2016-08-24 21:02:45+00:00,This is Nollie. She's waving at you. If you don't wave back you're a monster. She's also portable as hell. 12/10 ,Nollie,12.0,10.0,None,1.2,,,,,,0.0,6067.0
768473857036525572,2016-08-24 15:43:39+00:00,Meet Chevy. He had a late breakfast and now has to choose between a late lunch or an early dinner. 11/10 very pupset ,Chevy,11.0,10.0,None,1.1,labrador retriever,labrador retriever,labrador retriever,None,None,14147.0,3581.0
767884188863397888,2016-08-23 00:40:31+00:00,This is Tito. He's on the lookout. Nobody knows for what. 10/10 ,Tito,10.0,10.0,None,1.0,None,None,None,None,None,4938.0,1447.0
767500508068192258,2016-08-21 23:15:55+00:00,This is Louie. He's making quite a h*ckin mess. Doesn't seem to care. 12/10 jubilant af ,Louie,12.0,10.0,None,1.2,None,None,None,None,None,7763.0,2433.0
767191397493538821,2016-08-21 02:47:37+00:00,I don't know any of the backstory behind this picture but for some reason I'm crying. 13/10 for owner and doggo ,None,13.0,10.0,doggo,1.3,None,None,None,None,None,12735.0,3940.0
767122157629476866,2016-08-20 22:12:29+00:00,This is Rupert. You betrayed him with bath time but he forgives you. Cuddly af 13/10 ,Rupert,13.0,10.0,None,1.3,toy poodle,toy poodle,toy poodle,toy poodle,None,10520.0,2974.0
766864461642756096,2016-08-20 05:08:29+00:00,We only rate dogs... this is a Taiwanese Guide Walrus. Im getting real heckin tired of this. Please send dogs. 10/10 ,None,10.0,10.0,None,1.0,,,,,,0.0,5881.0
766793450729734144,2016-08-20 00:26:19+00:00,This is Rufus. He just missed out on the 100m final at Rio. Already training hard for Tokyo. 10/10 never give pup ,Rufus,10.0,10.0,None,1.0,None,None,None,None,None,5271.0,1410.0
766714921925144576,2016-08-19 19:14:16+00:00,His name is Charley and he already has a new set of wheels thanks to donations. I heard his top speed was also increased. 13/10 for Charley,None,13.0,10.0,None,1.3,,,,,,2699.0,394.0
766693177336135680,2016-08-19 17:47:52+00:00,This is Brudge. He's a Doberdog. Going to be h*ckin massive one day. 11/10 would pat on head approvingly ,Brudge,11.0,10.0,None,1.1,doberman,doberman,doberman,doberman,doberman,4165.0,826.0
766423258543644672,2016-08-18 23:55:18+00:00,This is Shadoe. Her tongue flies out of her mouth at random. Can't have a serious conversation with her. 9/10 ,Shadoe,9.0,10.0,None,0.9,keeshond,keeshond,keeshond,keeshond,keeshond,6239.0,1658.0
766313316352462849,2016-08-18 16:38:26+00:00,This is Oscar. He has legendary eyebrows and he h*ckin knows it. Curly af too. 12/10 would hug passionately ,Oscar,12.0,10.0,None,1.2,toy poodle,toy poodle,toy poodle,toy poodle,toy poodle,7036.0,1960.0
766078092750233600,2016-08-18 01:03:45+00:00,This is Colby. He's currently regretting all those times he shook your hand for an extra treat. 12/10 ,Colby,12.0,10.0,None,1.2,None,None,None,None,None,0.0,2727.0
766069199026450432,2016-08-18 00:28:24+00:00,This is Juno. She can see your future. 12/10 h*ckin mesmerizing af ,Juno,12.0,10.0,None,1.2,None,None,None,None,None,4410.0,889.0
766008592277377025,2016-08-17 20:27:34+00:00,This is Angel. She stole the @ShopWeRateDogs shirt from her owner. Fits pretty well actually. 11/10 would forgive ,Angel,11.0,10.0,None,1.1,welsh springer spaniel,welsh springer spaniel,welsh springer spaniel,None,None,3888.0,518.0
765719909049503744,2016-08-17 01:20:27+00:00,This is Brat. He has a hard time being ferocious so his owner helps out. H*ckin scary af now. 12/10 would still pet ,Brat,12.0,10.0,None,1.2,golden retriever,golden retriever,golden retriever,golden retriever,golden retriever,7506.0,2228.0
765669560888528897,2016-08-16 22:00:23+00:00,This is Tove. She's a Balsamic Poinsetter. Surprisingly deadly. 12/10 snug with caution ,Tove,12.0,10.0,None,1.2,beagle,beagle,beagle,beagle,beagle,5376.0,1266.0
765395769549590528,2016-08-16 03:52:26+00:00,This is my dog. Her name is Zoey. She knows I've been rating other dogs. She's not happy. 13/10 no bias at all ,Zoey,13.0,10.0,None,1.3,pembroke,None,None,None,None,27453.0,3522.0
765371061932261376,2016-08-16 02:14:15+00:00,This is Louie. He's had a long day. Did a lot of pupper things. Also appears to be rather heckin pettable. 11/10 ,Louie,11.0,10.0,None,1.1,golden retriever,golden retriever,golden retriever,golden retriever,None,7342.0,2251.0
764857477905154048,2016-08-14 16:13:27+00:00,This is Aubie. He has paws for days. Nibbling tables is one of his priorities. Second only to being cuddly af. 12/10 ,Aubie,12.0,10.0,None,1.2,bernese mountain dog,bernese mountain dog,bernese mountain dog,None,None,6675.0,1838.0
764259802650378240,2016-08-13 00:38:30+00:00,This is Kota and her son Benedict. She doesn't know why you're staring. They are a normal family. Both 10/10 ,Kota,10.0,10.0,None,1.0,german shepherd,german shepherd,german shepherd,german shepherd,german shepherd,6248.0,1568.0
763956972077010945,2016-08-12 04:35:10+00:00,@TheEllenShow I'm not sure if you know this but that doggo right there is a 12/10,None,12.0,10.0,doggo,1.2,,,,,,774.0,57.0
763183847194451968,2016-08-10 01:23:03+00:00,This is Clark. He collects teddy bears. It's absolutely h*ckin horrifying. 8/10 please stop this Clark ,Clark,8.0,10.0,None,0.8,None,None,None,None,None,5581.0,1538.0
763167063695355904,2016-08-10 00:16:21+00:00,Meet Eve. She's a raging alcoholic 8/10 (would b 11/10 but pupper alcoholism is a tragic issue that I can't condone) ,Eve,8.0,10.0,None,0.8,,,,,,0.0,3146.0
763103485927849985,2016-08-09 20:03:43+00:00,This is Belle. She's a Butterflop Hufflepoof. Rarer than most. Having trouble with car seat. 10/10 perturbed af ,Belle,10.0,10.0,None,1.0,None,None,None,None,None,7621.0,2371.0
762471784394268675,2016-08-08 02:13:34+00:00,Meet Glenn. Being in public scares him. Frighteningly relatable. 12/10 keep hangin in there Glenn (Imgur - Wuhahha) ,Glenn,12.0,10.0,None,1.2,samoyed,None,None,None,None,11652.0,6715.0
762316489655476224,2016-08-07 15:56:28+00:00,This is Scout. He specializes in mid-air freeze frames. 11/10 ,Scout,11.0,10.0,None,1.1,None,None,None,None,None,4970.0,1162.0
762035686371364864,2016-08-06 21:20:40+00:00,This left me speechless. 14/10 heckin heroic af ,None,14.0,10.0,None,1.4,None,None,None,None,None,33080.0,16199.0
761976711479193600,2016-08-06 17:26:19+00:00,This is Shelby. She finds stuff to put on her head for attention. It works really well. 12/10 talented af ,Shelby,12.0,10.0,None,1.2,None,None,None,None,None,5585.0,2088.0
761750502866649088,2016-08-06 02:27:27+00:00,"""Tristan do not speak to me with that kind of tone or I will take away the Xbox."" 10/10 ",None,10.0,10.0,None,1.0,golden retriever,None,None,None,None,0.0,4079.0
761745352076779520,2016-08-06 02:06:59+00:00,Guys.. we only rate dogs. Pls don't send any more pics of the Loch Ness Monster. Only send in dogs. Thank you. 11/10 ,None,11.0,10.0,None,1.1,None,None,None,None,None,4411.0,890.0
761599872357261312,2016-08-05 16:28:54+00:00,"This is Sephie. According to this picture, she can read. Fantastic at following directions. 11/10 such a good girl ",Sephie,11.0,10.0,None,1.1,None,None,None,None,None,4267.0,1227.0
761371037149827077,2016-08-05 01:19:35+00:00,Oh. My. God. 13/10 magical af ,None,13.0,10.0,None,1.3,None,None,None,None,None,0.0,18773.0
761334018830917632,2016-08-04 22:52:29+00:00,This is Bruce. I really want to hear the joke he was told. 10/10 for chuckle pup ,Bruce,10.0,10.0,None,1.0,norwegian elkhound,norwegian elkhound,norwegian elkhound,norwegian elkhound,None,5379.0,1506.0
761292947749015552,2016-08-04 20:09:17+00:00,Meet Bonaparte. He's pupset because it's cloudy at the beach. Can't take any pics for his Instagram. 11/10 ,Bonaparte,11.0,10.0,None,1.1,standard poodle,standard poodle,None,None,None,4624.0,1130.0
761227390836215808,2016-08-04 15:48:47+00:00,This is Albert. He just found out that bees are dying globally at an alarming rate. 10/10 heckin worried af now ,Albert,10.0,10.0,None,1.0,None,None,None,None,None,5495.0,1622.0
760893934457552897,2016-08-03 17:43:45+00:00,This is Wishes. He has the day off. Daily struggles of being a doggo have finally caught up with him. 11/10 ,Wishes,11.0,10.0,doggo,1.1,None,None,None,None,None,3951.0,1015.0
760656994973933572,2016-08-03 02:02:14+00:00,This is Rose. Her face is stuck like that. 11/10 would pet so heckin well ,Rose,11.0,10.0,None,1.1,golden retriever,golden retriever,golden retriever,None,None,6841.0,1982.0
760641137271070720,2016-08-03 00:59:13+00:00,This is Theo. He can walk on water. Still coming to terms with it. 12/10 magical af ,Theo,12.0,10.0,None,1.2,None,None,None,None,None,5135.0,1337.0
760539183865880579,2016-08-02 18:14:06+00:00,This is Atlas. Swinging is his passion. 12/10 would push all day ,Atlas,12.0,10.0,None,1.2,samoyed,samoyed,samoyed,samoyed,samoyed,7855.0,3763.0
760521673607086080,2016-08-02 17:04:31+00:00,"Doggo want what doggo cannot have. Temptation strong, dog stronger. 12/10  ",None,12.0,10.0,doggo,1.2,,,,,,4376.0,1449.0
