tweet_id,timestamp,text,name,numerator,denominator,dog_stage,rating_ratio,dog_breed50,dog_breed60,dog_breed70,dog_breed80,dog_breed90,favorite_count,retweet_count
699775878809702401,2016-02-17 02:02:25+00:00,Meet Fillup. Spaghetti is his main weakness. Also pissed because he's rewarded with cat treats 11/10 it'll be ok pup ,Fillup,11.0,10.0,None,1.1,None,None,None,None,None,2004.0,616.0
699691744225525762,2016-02-16 20:28:06+00:00,"This is Dave. He's a tropical pup. Short lil legs (dachshund mix?) Excels underwater, but refuses to eat kibble 5/10 ",Dave,5.0,10.0,None,0.5,None,None,None,None,None,10518.0,4735.0
699446877801091073,2016-02-16 04:15:05+00:00,"This is Archie. He's undercover in all these pics. Not actually a bee, cow, or Hawaiian. Sneaky af. 12/10 ",Archie,12.0,10.0,None,1.2,pembroke,pembroke,pembroke,pembroke,pembroke,6087.0,2671.0
699434518667751424,2016-02-16 03:25:58+00:00,I know this is a tad late but here's a wonderful Valentine's Day pupper 12/10 ,None,12.0,10.0,None,1.2,golden retriever,golden retriever,golden retriever,golden retriever,None,2217.0,525.0
699423671849451520,2016-02-16 02:42:52+00:00,"""Don't ever talk to me or my son again."" ...both 10/10 ",None,10.0,10.0,None,1.0,pug,pug,pug,pug,pug,1405.0,337.0
699413908797464576,2016-02-16 02:04:04+00:00,"Meet Miley. She's a Scandinavian Hollabackgirl. Incalculably fluffy, unamused af. 11/10 would squeeze aggressively ",Miley,11.0,10.0,None,1.1,samoyed,None,None,None,None,2127.0,632.0
699370870310113280,2016-02-15 23:13:03+00:00,Say hello to Calbert. He doesn't have enough legs. Wtf Calbert. Still havin a blast tho. 11/10 would pet extra well ,Calbert,11.0,10.0,None,1.1,None,None,None,None,None,1933.0,452.0
699323444782047232,2016-02-15 20:04:36+00:00,"""I'm bathing the children what do you want?""  ...both 10/10 ",None,10.0,10.0,None,1.0,None,None,None,None,None,3240.0,887.0
699088579889332224,2016-02-15 04:31:20+00:00,This is Charl. He's a bully. Chucks that dumbbell around like its nothing. Sharp neck. Exceptionally unfluffy. 3/10 ,Charl,3.0,10.0,None,0.3,None,None,None,None,None,2293.0,650.0
699079609774645248,2016-02-15 03:55:41+00:00,Meet Reagan. He's a Persnicketus Derpson. Great with kids. Permanently caught off guard. 8/10 ,Reagan,8.0,10.0,None,0.8,schipperke,schipperke,None,None,None,2510.0,674.0
699072405256409088,2016-02-15 03:27:04+00:00,ERMAHGERD 12/10 please enjoy ,None,12.0,10.0,None,1.2,shih-tzu,None,None,None,None,3068.0,1220.0
699060279947165696,2016-02-15 02:38:53+00:00,This is Yukon. He pukes rainbows. 12/10 magical af ,Yukon,12.0,10.0,None,1.2,,,,,,3861.0,1847.0
699036661657767936,2016-02-15 01:05:02+00:00,HAPPY V-DAY FROM YOUR FAV PUPPER SQUAD 13/10 for all ,None,13.0,10.0,None,1.3,None,None,None,None,None,2664.0,1222.0
698989035503689728,2016-02-14 21:55:47+00:00,This is Oliver. He does toe touches in his sleep. 13/10 precious af ,Oliver,13.0,10.0,None,1.3,None,None,None,None,None,3455.0,1002.0
698953797952008193,2016-02-14 19:35:46+00:00,Meet CeCe. She wanted to take a selfie before her first day as a lumberjack. 11/10 crushing traditional gender roles ,CeCe,11.0,10.0,None,1.1,None,None,None,None,None,2771.0,929.0
698907974262222848,2016-02-14 16:33:40+00:00,This dog is never sure if he's doing the right thing. 10/10 ,None,10.0,10.0,None,1.0,german short-haired pointer,german short-haired pointer,german short-haired pointer,german short-haired pointer,german short-haired pointer,2600.0,642.0
698710712454139905,2016-02-14 03:29:49+00:00,This is Cuddles. He's not entirely sure how doors work. 10/10 I believe in you Cuddles ,Cuddles,10.0,10.0,None,1.0,None,None,None,None,None,2533.0,698.0
698703483621523456,2016-02-14 03:01:06+00:00,This is Rusty. He has no respect for POULTRY products. Unbelievable af. 7/10 would still pet ,Rusty,7.0,10.0,None,0.7,brittany spaniel,brittany spaniel,brittany spaniel,brittany spaniel,brittany spaniel,1487.0,391.0
698635131305795584,2016-02-13 22:29:29+00:00,Here we are witnessing five Guatemalan Birch Floofs in their natural habitat. All 12/10 (Vid by @pootdanielle) ,None,12.0,10.0,None,1.2,None,None,None,None,None,1320.0,348.0
698549713696649216,2016-02-13 16:50:04+00:00,This is Claude. He's trying to be seductive but he forgot to turn on the fireplace. 9/10 damn it Claude ,Claude,9.0,10.0,None,0.9,french bulldog,french bulldog,french bulldog,french bulldog,french bulldog,2382.0,639.0
698355670425473025,2016-02-13 03:59:01+00:00,This is Jessiga. She's a Tasmanian McCringleberry. Selfies make her uncomfortable. 10/10 would pet in time of need ,Jessiga,10.0,10.0,None,1.0,pug,pug,pug,pug,pug,1913.0,462.0
698342080612007937,2016-02-13 03:05:01+00:00,This is Maximus. He's training for the tetherball world championship. The grind never stops. 11/10 (vid by @Amuly21) ,Maximus,11.0,10.0,None,1.1,boxer,boxer,boxer,boxer,None,2314.0,971.0
698262614669991936,2016-02-12 21:49:15+00:00,This is Franklin. He's a yoga master. Trying to get rid of those rolls. Dedicated af. 11/10 keep it up pup ,Franklin,11.0,10.0,None,1.1,None,None,None,None,None,4875.0,2049.0
698178924120031232,2016-02-12 16:16:41+00:00,This is Lily. She accidentally dropped all her Kohl's cash overboard. Day officially ruined. 10/10 hang in there pup ,Lily,10.0,10.0,None,1.0,None,None,None,None,None,2879.0,763.0
697995514407682048,2016-02-12 04:07:53+00:00,"""Dammit hooman quit playin I jus wanna wheat thin"" 11/10 ",None,11.0,10.0,None,1.1,None,None,None,None,None,1555.0,341.0
697990423684476929,2016-02-12 03:47:39+00:00,This is Doug. He's a Draconian Jabbawockee. Rad tongue. Ears are borderline legendary 11/10 would pet with a purpose ,Doug,11.0,10.0,None,1.1,pembroke,pembroke,pembroke,pembroke,pembroke,3366.0,1324.0
697943111201378304,2016-02-12 00:39:39+00:00,This is Cassie. She goes door to door trying to find the owner of this baguette. No luck so far. 10/10 ,Cassie,10.0,10.0,None,1.0,None,None,None,None,None,2448.0,703.0
697881462549430272,2016-02-11 20:34:41+00:00,This is Carter. He wakes up in the morning and pisses excellence. 10/10 best there is plain and simple ,Carter,10.0,10.0,None,1.0,None,None,None,None,None,3086.0,1216.0
697630435728322560,2016-02-11 03:57:11+00:00,Pls make sure ur dogs have gone through some barkour training b4 they attempt stunts like this. 8/10 ,None,8.0,10.0,None,0.8,,,,,,1796.0,551.0
697616773278015490,2016-02-11 03:02:54+00:00,This pupper doubles as a hallway rug. Very rare. Versatile af. 11/10 ,None,11.0,10.0,None,1.1,lhasa,None,None,None,None,3237.0,1034.0
697596423848730625,2016-02-11 01:42:02+00:00,Here's a pupper with a piece of pizza. Two of everybody's favorite things in one photo. 11/10 ,None,11.0,10.0,None,1.1,shetland sheepdog,shetland sheepdog,None,None,None,3098.0,1288.0
697575480820686848,2016-02-11 00:18:49+00:00,This is Ole. He's not sure how to gravity. 8/10 ,Ole,8.0,10.0,None,0.8,None,None,None,None,None,2091.0,511.0
697516214579523584,2016-02-10 20:23:19+00:00,Say hello to Pherb. He does parkour. 9/10 ,Pherb,9.0,10.0,None,0.9,,,,,,2122.0,1149.0
697482927769255936,2016-02-10 18:11:03+00:00,Meet Blipson. He's a Doowap Hufflepuff. That Ugg is his temporary home while he's struggling with unemployment 11/10 ,Blipson,11.0,10.0,None,1.1,None,None,None,None,None,2473.0,692.0
697463031882764288,2016-02-10 16:51:59+00:00,Happy Wednesday here's a bucket of pups. 44/40 would pet all at once ,None,44.0,40.0,None,1.1,labrador retriever,labrador retriever,labrador retriever,labrador retriever,labrador retriever,3497.0,1422.0
697270446429966336,2016-02-10 04:06:43+00:00,This is Bentley. He got stuck on his 3rd homework problem. Picturing the best case scenario if he drops out. 10/10 ,Bentley,10.0,10.0,None,1.0,toy poodle,toy poodle,toy poodle,toy poodle,None,4797.0,1924.0
697259378236399616,2016-02-10 03:22:44+00:00,"Please stop sending in saber-toothed tigers. This is getting ridiculous. We only rate dogs.
...8/10 ",None,8.0,10.0,None,0.8,great dane,great dane,great dane,great dane,great dane,3364.0,1028.0
697255105972801536,2016-02-10 03:05:46+00:00,Meet Charlie. He likes to kiss all the big milk dogs with the rad earrings. Passionate af. 10/10 just a great guy ,Charlie,10.0,10.0,None,1.0,None,None,None,None,None,3098.0,1191.0
697242256848379904,2016-02-10 02:14:42+00:00,This is Oakley. He has a massive tumor growing on his head. Seems benign tho. 10/10 would pet around tumor ,Oakley,10.0,10.0,None,1.0,None,None,None,None,None,2573.0,685.0
696900204696625153,2016-02-09 03:35:31+00:00,This is Rosie. She's a Benebark Cumberpatch. Sleepy af. 12/10 would snug for days ,Rosie,12.0,10.0,None,1.2,None,None,None,None,None,3247.0,1044.0
696894894812565505,2016-02-09 03:14:25+00:00,These two pirates crashed their ship and don't know what to do now. Very irresponsible of them. Both 9/10 ,None,9.0,10.0,None,0.9,appenzeller,appenzeller,None,None,None,2400.0,692.0
696886256886657024,2016-02-09 02:40:05+00:00,Guys I found the dog from Up. 12/10 ,None,12.0,10.0,None,1.2,None,None,None,None,None,4982.0,1847.0
696877980375769088,2016-02-09 02:07:12+00:00,This is Misty. She's in a predicament. Not sure what next move should be. 9/10 stay calm pupper I'm comin ,Misty,9.0,10.0,None,0.9,None,None,None,None,None,2495.0,722.0
696754882863349760,2016-02-08 17:58:03+00:00,This is Reptar. He specifically asked for his skis to have four bindings. He's not happy. Quite perturbed tbh. 10/10 ,Reptar,10.0,10.0,None,1.0,None,None,None,None,None,1517.0,370.0
696744641916489729,2016-02-08 17:17:22+00:00,This is Klevin. He doesn't want his family brainwashed by mainstream media. 10/10 (vid by @AshtonHose) ,Klevin,10.0,10.0,None,1.0,,,,,,2119.0,963.0
696713835009417216,2016-02-08 15:14:57+00:00,This is Trevith. He's a Swiss Mountain Roadwoof. Breeze too powerful. 9/10 stay strong pupper ,Trevith,9.0,10.0,None,0.9,None,None,None,None,None,2428.0,666.0
696518437233913856,2016-02-08 02:18:30+00:00,Oh my god 10/10 for every little hot dog pupper,None,10.0,10.0,None,1.0,,,,,,3997.0,1745.0
696490539101908992,2016-02-08 00:27:39+00:00,After reading the comments I may have overestimated this pup. Downgraded to a 1/10. Please forgive me,None,1.0,10.0,None,0.1,,,,,,1240.0,145.0
696488710901260288,2016-02-08 00:20:23+00:00,12/10 revolutionary af ,None,12.0,10.0,None,1.2,None,None,None,None,None,2601.0,1044.0
696405997980676096,2016-02-07 18:51:43+00:00,This is Berb. He just found out that they have made 31 Kidz Bop CD's. Downright terrifying. 7/10 hang in there Berb ,Berb,7.0,10.0,None,0.7,None,None,None,None,None,3281.0,1180.0
696100768806522880,2016-02-06 22:38:50+00:00,This poor pupper has been stuck in a vortex since last week. Please keep her in your thoughts. 10/10 ,None,10.0,10.0,None,1.0,,,,,,1980.0,674.0
695816827381944320,2016-02-06 03:50:33+00:00,Here's a dog enjoying a sunset. 11/10 would trade lives with ,None,11.0,10.0,None,1.1,None,None,None,None,None,3078.0,1193.0
695794761660297217,2016-02-06 02:22:53+00:00,This is Wyatt. His throne is modeled after him. 13/10 Wyatt is a very big deal ,Wyatt,13.0,10.0,None,1.3,samoyed,samoyed,samoyed,samoyed,samoyed,3239.0,796.0
695767669421768709,2016-02-06 00:35:13+00:00,If you are aware of who is making these please let me know. 13/10 vroom vroom ,None,13.0,10.0,None,1.3,soft-coated wheaten terrier,soft-coated wheaten terrier,soft-coated wheaten terrier,soft-coated wheaten terrier,None,1912.0,765.0
695629776980148225,2016-02-05 15:27:17+00:00,Meet Calvin. He's proof that degrees mean absolutely nothing. 8/10 straighten up pup ,Calvin,8.0,10.0,None,0.8,old english sheepdog,old english sheepdog,None,None,None,4684.0,2152.0
695446424020918272,2016-02-05 03:18:42+00:00,We normally don't rate unicorns but this one has 3 ears so it must be super rare. 12/10 majestic af ,None,12.0,10.0,None,1.2,basenji,basenji,basenji,None,None,4495.0,1857.0
695409464418041856,2016-02-05 00:51:51+00:00,This is Bob. He just got back from his job interview and realized his ear was inside-out the whole time. 10/10 ,Bob,10.0,10.0,None,1.0,pug,pug,pug,pug,pug,8872.0,3676.0
695314793360662529,2016-02-04 18:35:39+00:00,This is Colin. He really likes green beans. It's tearing his family apart. 10/10 please pray for Colin ,Colin,10.0,10.0,None,1.0,maltese dog,maltese dog,None,None,None,3721.0,1490.0
695095422348574720,2016-02-04 04:03:57+00:00,This is just a beautiful pupper good shit evolution. 12/10 ,None,12.0,10.0,None,1.2,None,None,None,None,None,2697.0,631.0
695074328191332352,2016-02-04 02:40:08+00:00,This is Lorenzo. He's educated af. Just graduated college. 11/10 poor pupper can't even comprehend his debt ,Lorenzo,11.0,10.0,None,1.1,shih-tzu,None,None,None,None,2913.0,1130.0
695064344191721472,2016-02-04 02:00:27+00:00,"This may be the greatest video I've ever been sent. 4/10 for Charles the puppy, 13/10 overall. (Vid by @stevenxx_) ",None,4.0,10.0,None,0.4,None,None,None,None,None,1633.0,605.0
695051054296211456,2016-02-04 01:07:39+00:00,"Meet Brian (pronounced ""Kirk""). He's not amused by ur churlish tomfoolery. Once u put him down you're done for. 6/10 ",Brian,6.0,10.0,None,0.6,boston bull,boston bull,boston bull,None,None,2728.0,801.0
694925794720792577,2016-02-03 16:49:55+00:00,Please only send in dogs. This t-rex is very scary. 5/10 ...might still pet (vid by @helizabethmicha) ,None,5.0,10.0,None,0.5,,,,,,2765.0,941.0
694905863685980160,2016-02-03 15:30:43+00:00,This is Archie. He's a Bisquick Taj Mapaw. Too many people are touching him. It is doing him a discomfort. 10/10 ,Archie,10.0,10.0,None,1.0,None,None,None,None,None,2816.0,956.0
694356675654983680,2016-02-02 03:08:26+00:00,"This pupper only appears through the hole of a Funyun. Much like Phineas, this one is also mysterious af. 10/10 ",None,10.0,10.0,None,1.0,None,None,None,None,None,1539.0,293.0
694352839993344000,2016-02-02 02:53:12+00:00,Meet OliviÃ©r. He takes killer selfies. Has a dog of his own. It leaps at random &amp; can't bark for shit. 10/10 &amp; 5/10 ,OliviÃ©r,10.0,10.0,None,1.0,None,None,None,None,None,2088.0,632.0
694342028726001664,2016-02-02 02:10:14+00:00,It's okay pup. This happens every time I listen to @adele also. 11/10 (vid by @_larirutschmann) ,None,11.0,10.0,None,1.1,,,,,,1604.0,491.0
694329668942569472,2016-02-02 01:21:07+00:00,Meet Grady. He's very hungry. Too bad no one can find his food bowl. 9/10 poor pupper ,Grady,9.0,10.0,None,0.9,boxer,boxer,boxer,boxer,boxer,2048.0,514.0
694206574471057408,2016-02-01 17:11:59+00:00,"""Martha come take a look at this. I'm so fed up with the media's unrealistic portrayal of dogs these days."" 10/10 ",None,10.0,10.0,None,1.0,None,None,None,None,None,4268.0,2082.0
694183373896572928,2016-02-01 15:39:48+00:00,This is Lola. She realized mid hug that she's not ready for a committed relationship with a teddy bear. 9/10 ,Lola,9.0,10.0,None,0.9,None,None,None,None,None,3018.0,953.0
694001791655137281,2016-02-01 03:38:15+00:00,This is Chester. He's a Benefloof Cumberbark. Fabulous ears. Nifty shirt. Was probably on sale. Nice hardwood. 11/10 ,Chester,11.0,10.0,None,1.1,pembroke,pembroke,pembroke,None,None,3481.0,1052.0
693993230313091072,2016-02-01 03:04:14+00:00,These lil fellas are the best of friends. 12/10 for both. 1 like = 1 friend (vid by @CassieBrookee15) ,None,12.0,10.0,None,1.2,,,,,,1914.0,414.0
693942351086120961,2016-01-31 23:42:03+00:00,This is Kobe. He's a Speckled Rorschach. Requests that someone holds his hand during car rides. 10/10 sick interior ,Kobe,10.0,10.0,None,1.0,groenendael,None,None,None,None,1777.0,376.0
693647888581312512,2016-01-31 04:11:58+00:00,What kind of person sends in a pic without a dog in it? So churlish. Neat rug tho 7/10 ,None,7.0,10.0,None,0.7,None,None,None,None,None,2758.0,605.0
693644216740769793,2016-01-31 03:57:23+00:00,BREAKING PUPDATE: I've just been notified that (if in U.S.) this dog appears to be operating the vehicle. Upgraded to 10/10. Skilled af,None,10.0,10.0,None,1.0,,,,,,1373.0,126.0
693642232151285760,2016-01-31 03:49:30+00:00,Meet Freddery. He's a Westminster Toblerone. Seems to enjoy car rides. 9/10 would pat on the head approvingly ,Freddery,9.0,10.0,None,0.9,None,None,None,None,None,2598.0,418.0
693629975228977152,2016-01-31 03:00:47+00:00,This pupper is afraid of its own feet. 12/10 would comfort ,None,12.0,10.0,None,1.2,pug,pug,pug,pug,None,2505.0,812.0
693622659251335168,2016-01-31 02:31:43+00:00,When you keepin the popcorn bucket in your lap and she reach for some... 10/10 ,None,10.0,10.0,None,1.0,None,None,None,None,None,1575.0,378.0
693590843962331137,2016-01-31 00:25:18+00:00,Meet Phil. He's big af. Currently destroying this nice family home. Completely uncalled for. 3/10 not a good pupper ,Phil,3.0,10.0,None,0.3,None,None,None,None,None,5176.0,2012.0
693582294167244802,2016-01-30 23:51:19+00:00,"Personally I'd give him an 11/10. Not sure why you think you're qualified to rate such a stellar pup.
@CommonWhiteGirI",None,11.0,10.0,None,1.1,,,,,,1688.0,259.0
693486665285931008,2016-01-30 17:31:20+00:00,This is Lincoln. He doesn't understand his new jacket. 11/10 please enjoy (vid by @GraceIsTheName8) ,Lincoln,11.0,10.0,None,1.1,None,None,None,None,None,1822.0,651.0
693280720173801472,2016-01-30 03:52:58+00:00,This is Sadie and her 2 pups Shebang &amp; Ruffalo. Sadie says single parenting is challenging but rewarding. All 10/10 ,Sadie,10.0,10.0,None,1.0,None,None,None,None,None,3443.0,1267.0
693267061318012928,2016-01-30 02:58:42+00:00,This is Oscar. He can wave. Friendly af. 12/10 would totally wave back (IG: Oscar.is.bear) ,Oscar,12.0,10.0,None,1.2,,,,,,2443.0,833.0
693262851218264065,2016-01-30 02:41:58+00:00,I hope you guys enjoy this beautiful snowy pupper as much as I did. 11/10 ,None,11.0,10.0,None,1.1,golden retriever,golden retriever,golden retriever,golden retriever,golden retriever,2279.0,511.0
693231807727280129,2016-01-30 00:38:37+00:00,"This is Bodie. He's not proud of what he did, but it needed to be done. 9/10 eight days was a pretty good streak tbh ",Bodie,9.0,10.0,None,0.9,vizsla,vizsla,vizsla,vizsla,None,2936.0,752.0
693155686491000832,2016-01-29 19:36:08+00:00,This is Dunkin. He can only see when he's wet (tragic). 12/10 future heartbreaker ,Dunkin,12.0,10.0,None,1.2,shih-tzu,shih-tzu,None,None,None,8062.0,3282.0
693109034023534592,2016-01-29 16:30:45+00:00,"""Thank you friend that was a swell petting"" 11/10 (vid by @MatthewjamesMac) ",None,11.0,10.0,None,1.1,cocker spaniel,cocker spaniel,cocker spaniel,None,None,1760.0,638.0
693095443459342336,2016-01-29 15:36:45+00:00,This is Milo. He doesn't understand your fancy human gestures. Will lick instead. 10/10 can't faze this pupper ,Milo,10.0,10.0,None,1.0,None,None,None,None,None,1908.0,478.0
692919143163629568,2016-01-29 03:56:12+00:00,Please only send in dogs. Don't submit other things like this pic of Kenny Chesney in a bathtub. Thank you. 9/10 ,None,9.0,10.0,None,0.9,saint bernard,saint bernard,None,None,None,2727.0,770.0
692905862751522816,2016-01-29 03:03:25+00:00,This is Wally. He's being abducted by aliens. 10/10 poor pupper ,Wally,10.0,10.0,None,1.0,None,None,None,None,None,2489.0,894.0
692901601640583168,2016-01-29 02:46:29+00:00,"""Fuck the system"" 10/10 ",None,10.0,10.0,None,1.0,None,None,None,None,None,1813.0,616.0
692894228850999298,2016-01-29 02:17:12+00:00,Meet Tupawc. He's actually a Christian rapper. Doesn't even understand the concept of dollar signs. 10/10 great guy ,Tupawc,10.0,10.0,None,1.0,german short-haired pointer,german short-haired pointer,german short-haired pointer,german short-haired pointer,None,2327.0,824.0
692828166163931137,2016-01-28 21:54:41+00:00,This pupper just descended from heaven. 12/10 can probably fly ,None,12.0,10.0,None,1.2,samoyed,samoyed,samoyed,samoyed,samoyed,2941.0,902.0
692752401762250755,2016-01-28 16:53:37+00:00,"""Hello yes could I get one pupper to go please thank you""
Both 13/10 ",None,13.0,10.0,None,1.3,None,None,None,None,None,6990.0,3729.0
692568918515392513,2016-01-28 04:44:32+00:00,This is Chester. He's been guarding this pumpkin since October. Dedicated af. Hat is nifty as hell. 12/10 would snug ,Chester,12.0,10.0,None,1.2,golden retriever,golden retriever,None,None,None,4455.0,1576.0
692535307825213440,2016-01-28 02:30:58+00:00,This is Amber. She's a Fetty Woof. 10/10 would pet in a heartbeat ,Amber,10.0,10.0,None,1.0,None,None,None,None,None,3257.0,1396.0
692530551048294401,2016-01-28 02:12:04+00:00,Say hello to Cody. He's been to like 80 countries and is way more cultured than you. He wanted me to say that. 10/10 ,Cody,10.0,10.0,None,1.0,None,None,None,None,None,1879.0,422.0
692423280028966913,2016-01-27 19:05:49+00:00,PUPDATE: just noticed this dog has some extra legs. Very advanced. Revolutionary af. Upgraded to a 9/10,None,9.0,10.0,None,0.9,,,,,,1515.0,233.0
692187005137076224,2016-01-27 03:26:56+00:00,This is a rare Arctic Wubberfloof. Unamused by the happenings. No longer has the appetites. 12/10 would totally hug ,None,12.0,10.0,None,1.2,siberian husky,siberian husky,siberian husky,siberian husky,None,2589.0,839.0
692158366030913536,2016-01-27 01:33:08+00:00,This is Edgar. He's a Sassafras Puggleflash. Nothing satisfies him. Not since the war. 10/10 cheer up pup ,Edgar,10.0,10.0,None,1.0,pug,pug,pug,pug,pug,2190.0,806.0
692142790915014657,2016-01-27 00:31:15+00:00,These are some pictures of Teddy that further justify his 13/10 rating. Please enjoy ,None,13.0,10.0,None,1.3,toy poodle,toy poodle,None,None,None,1682.0,402.0
692041934689402880,2016-01-26 17:50:29+00:00,This is Teddy. His head is too heavy. 13/10 (vid by @jooanrim) ,Teddy,13.0,10.0,None,1.3,,,,,,3483.0,1298.0
692017291282812928,2016-01-26 16:12:33+00:00,This is Kingsley Wellensworth III. He owns 7 range rovers. Has a cardigan collection. Would rather be sailing. 9/10 ,Kingsley,9.0,10.0,None,0.9,None,None,None,None,None,2939.0,983.0
691820333922455552,2016-01-26 03:09:55+00:00,This is Brockly. He's an uber driver. Falls asleep at the wheel often. Irresponsible af 8/10 would totally still pet ,Brockly,8.0,10.0,None,0.8,None,None,None,None,None,4048.0,1702.0
691793053716221953,2016-01-26 01:21:31+00:00,We usually don't rate penguins but this one is in need of a confidence boost after that slide. 10/10 ,None,10.0,10.0,None,1.0,,,,,,8330.0,4330.0
691756958957883396,2016-01-25 22:58:05+00:00,"THE BRITISH ARE COMING
THE BRITISH ARE COMING
10/10 ",None,10.0,10.0,None,1.0,None,None,None,None,None,2938.0,1034.0
691675652215414786,2016-01-25 17:35:00+00:00,This is Richie and Plip. They are the best of pals. Do everything together. 10/10 for both ,Richie,10.0,10.0,None,1.0,None,None,None,None,None,1994.0,522.0
691483041324204033,2016-01-25 04:49:38+00:00,When bae says they can't go out but you see them with someone else that same night. 5/10 &amp; 10/10 for heartbroken pup ,None,5.0,10.0,None,0.5,bloodhound,bloodhound,bloodhound,bloodhound,None,2437.0,576.0
691459709405118465,2016-01-25 03:16:56+00:00,Say hello to Leo. He's a Fallopian Puffalope. Precious af. 12/10 would cuddle ,Leo,12.0,10.0,None,1.2,shetland sheepdog,None,None,None,None,4139.0,1169.0
691444869282295808,2016-01-25 02:17:57+00:00,This is Bailey. She likes flowers. 12/10 ,Bailey,12.0,10.0,None,1.2,bernese mountain dog,bernese mountain dog,bernese mountain dog,None,None,2712.0,869.0
691321916024623104,2016-01-24 18:09:23+00:00,This is Molly. She's a Peruvian Niddlewog. Loves her new hat. 11/10 would totally pet ,Molly,11.0,10.0,None,1.1,rottweiler,None,None,None,None,2632.0,673.0
691096613310316544,2016-01-24 03:14:07+00:00,Here we see one dog giving a puptalk to another dog. Both are focused af. Left one has powerful feet. 11/10 for both ,None,11.0,10.0,None,1.1,None,None,None,None,None,3029.0,901.0
691090071332753408,2016-01-24 02:48:07+00:00,Happy Saturday here's a dog in a mailbox. 12/10 ,None,12.0,10.0,None,1.2,None,None,None,None,None,1755.0,342.0
690989312272396288,2016-01-23 20:07:44+00:00,We've got a doggy down. Requesting backup. 12/10 for both. Please enjoy  ,None,12.0,10.0,None,1.2,,,,,,6037.0,2947.0
690959652130045952,2016-01-23 18:09:53+00:00,This golden is happy to refute the soft mouth egg test. Not a fan of sweeping generalizations. 11/10 #notallpuppers ,None,11.0,10.0,None,1.1,golden retriever,golden retriever,golden retriever,golden retriever,None,3677.0,1281.0
690938899477221376,2016-01-23 16:47:25+00:00,"She thought the sunset was pretty, but I thought she was prettier. 10/10 ",None,10.0,10.0,None,1.0,None,None,None,None,None,4219.0,2027.0
690932576555528194,2016-01-23 16:22:17+00:00,This is Buddy. He's testing out the water. Such caution. Much reserve. 12/10 ,Buddy,12.0,10.0,None,1.2,None,None,None,None,None,3373.0,1051.0
690735892932222976,2016-01-23 03:20:44+00:00,Say hello to Peaches. She's a Dingleberry Zanderfloof. 13/10 would caress lots ,Peaches,13.0,10.0,None,1.3,golden retriever,golden retriever,golden retriever,golden retriever,None,3873.0,1300.0
690728923253055490,2016-01-23 02:53:03+00:00,This is Vinscent. He was just questioned about his recent credit card spending. 8/10 ,Vinscent,8.0,10.0,None,0.8,None,None,None,None,None,2229.0,528.0
690690673629138944,2016-01-23 00:21:03+00:00,This is Cedrick. He's a spookster. Did me a discomfort. 10/10 would pet with a purpose ,Cedrick,10.0,10.0,None,1.0,None,None,None,None,None,2380.0,829.0
690649993829576704,2016-01-22 21:39:24+00:00,This is Hazel. She's a gymnast. Training hard for Rio. 11/10 focused af ,Hazel,11.0,10.0,None,1.1,None,None,None,None,None,1338.0,287.0
690607260360429569,2016-01-22 18:49:36+00:00,12/10 @LightningHoltt,None,12.0,10.0,None,1.2,,,,,,297.0,17.0
690597161306841088,2016-01-22 18:09:28+00:00,This is Lolo. She's America af. Behind in science &amp; math but can say whatever she wants on Twitter. 11/10 ...Merica ,Lolo,11.0,10.0,None,1.1,None,None,None,None,None,2009.0,624.0
690400367696297985,2016-01-22 05:07:29+00:00,"This is Eriq. His friend just reminded him of last year's super bowl. Not cool friend
10/10 for Eriq
6/10 for friend ",Eriq,10.0,10.0,None,1.0,None,None,None,None,None,1923.0,464.0
